{
  "$schema": "https://json-schema.org/draft/2020-12/schema",
  "$id": "https://github.com/joshualikaist/Babdoduk/schemas/ggongbab-archive.schema.json",
  "title": "Past free-food listings: data/ggongbab/archive/index.json",
  "description": "Written by scripts/refresh_ggongbab.py (ggongbab.exporter.build_archive) and read by ggongbab.html and the home calendar. An archived event is a live-feed event without registration or confidence: nothing in it can be signed up for.",
  "type": "object",
  "required": ["generatedAt", "timezone", "windowDays", "count", "events"],
  "additionalProperties": false,
  "properties": {
    "schemaVersion": {"type": "integer", "const": 1},
    "generatedAt": {"$ref": "#/$defs/kstTime"},
    "timezone": {"const": "Asia/Seoul"},
    "windowDays": {"type": "integer", "minimum": 1},
    "count": {"type": "integer", "minimum": 0},
    "events": {"type": "array", "items": {"$ref": "#/$defs/event"}}
  },
  "$defs": {
    "kstTime": {"type": "string", "pattern": "^\\d{4}-\\d{2}-\\d{2}T\\d{2}:\\d{2}:\\d{2}\\+09:00$"},
    "kstTimeOrNull": {"type": ["string", "null"], "pattern": "^\\d{4}-\\d{2}-\\d{2}T\\d{2}:\\d{2}:\\d{2}\\+09:00$"},
    "tri": {"enum": ["true", "false", "unknown"]},
    "urlOrEmpty": {"type": ["string", "null"], "pattern": "^(https?://[^\\s/]+\\S*)?$"},
    "event": {
      "type": "object",
      "required": ["id", "title", "summary", "startAt", "endAt", "dateText", "timeText", "location", "food",
                   "organizer", "eligibility", "sources"],
      "additionalProperties": false,
      "properties": {
        "id": {"type": "string", "pattern": "^[A-Za-z0-9][A-Za-z0-9_.:-]{0,127}$"},
        "title": {"type": "string", "minLength": 1},
        "summary": {"type": "string"},
        "startAt": {"$ref": "#/$defs/kstTime"},
        "endAt": {"$ref": "#/$defs/kstTimeOrNull"},
        "dateText": {"type": "string"},
        "timeText": {"type": "string"},
        "location": {
          "type": "object",
          "required": ["name", "building", "room"],
          "additionalProperties": false,
          "properties": {
            "name": {"type": "string"},
            "building": {"type": "string"},
            "room": {"type": "string"}
          }
        },
        "food": {
          "type": "object",
          "required": ["provided", "type", "description"],
          "additionalProperties": false,
          "properties": {
            "provided": {"$ref": "#/$defs/tri"},
            "type": {"enum": ["meal", "lunchbox", "snack", "refreshment", "beverage", "coupon", "other", "unknown"]},
            "description": {"type": "string"},
            "source": {"enum": ["text", "poster"]}
          }
        },
        "giveaway": {
          "description": "Present only when participants can win or receive a prize or gift (owner decision 2026-10-14); the page marks the listing with a gift and keeps it out of the free-food counts.",
          "type": "object",
          "required": ["provided", "description"],
          "additionalProperties": false,
          "properties": {
            "provided": {"const": "true"},
            "description": {"type": "string"}
          }
        },
        "organizer": {"type": "string"},
        "eligibility": {"type": "string"},
        "sources": {
          "type": "array",
          "items": {
            "type": "object",
            "required": ["type", "name"],
            "additionalProperties": false,
            "properties": {
              "type": {"enum": ["dooray", "dooray_mailbox", "kaist_public", "manual", "portal"]},
              "name": {"enum": ["Dooray", "Dooray 메일함", "KAIST 공지", "Manual", "KAIST Portal"]},
              "url": {"$ref": "#/$defs/urlOrEmpty"}
            }
          }
        },
        "sessions": {
          "description": "Optional. Every day or session of a multi-day event, in order, 2 to 14 items; the first starts at startAt and none ends after endAt (2026-10-18). Read back from the stored AI parse (scripts/ggongbab/parse_extras.py).",
          "type": "array", "minItems": 2, "maxItems": 14,
          "items": {
            "type": "object",
            "required": ["startAt", "endAt"],
            "additionalProperties": false,
            "properties": {
              "startAt": {"$ref": "#/$defs/kstTime"},
              "endAt": {"$ref": "#/$defs/kstTimeOrNull"},
              "location": {
                "type": "object",
                "required": ["name", "building", "room"],
                "additionalProperties": false,
                "properties": {
                  "name": {"type": "string"},
                  "building": {"type": "string"},
                  "room": {"type": "string"}
                }
              },
              "foodDescription": {"type": "string"}
            }
          }
        },
        "audience": {
          "description": "Optional. Who the event is for. basis 'stated': the source says so; 'inferred': only under the strict rule of the extraction prompt, shown with an 'estimated' mark (2026-10-18).",
          "type": "object",
          "required": ["text", "basis"],
          "additionalProperties": false,
          "properties": {
            "text": {"type": "string", "minLength": 1, "maxLength": 60},
            "basis": {"enum": ["stated", "inferred"]}
          }
        }
      }
    }
  }
}
