{
  "schemaVersion": 1,
  "generatedAt": "2026-10-17T22:16:12+09:00",
  "timezone": "Asia/Seoul",
  "windowDays": 30,
  "count": 4,
  "events": [
    {
      "id": "35ea43d7-f095-4541-ac2c-877c3c11c651",
      "title": "2026 가을학기 중간고사 ME PIZZA DAY",
      "summary": "기계공학과 전체 학부 학생을 대상으로 2026년 가을학기 중간고사 PIZZA DAY를 진행합니다. 피자와 음료 등이 제공됩니다.",
      "startAt": "2026-10-16T18:00:00+09:00",
      "endAt": null,
      "dateText": "2026.10.16.(금)",
      "timeText": "18:00~",
      "location": {
        "name": "기계공학동(N7) 야외 BBQ PIT",
        "building": "N7",
        "room": "야외 BBQ PIT"
      },
      "food": {
        "provided": "true",
        "type": "meal",
        "description": "피자 + 음료 등",
        "source": "text"
      },
      "organizer": "기계공학과행정팀",
      "eligibility": "기계공학과 전체 학부 학생",
      "sources": [
        {
          "type": "dooray",
          "name": "Dooray"
        }
      ]
    },
    {
      "id": "3f1c34c3-a144-444f-bc56-a8734b778298",
      "title": "KAIST 기후테크 세미나 #5",
      "summary": "기후테크 창업가의 \"전환\" — 바이오 기술로 희토류를 회수하기까지를 주제로 하는 세미나입니다. KAIST 학생·연구원·창업팀 누구나 참여할 수 있으며, 사전 신청자에게 햄버거를 제공합니다.",
      "startAt": "2026-10-14T13:00:00+09:00",
      "endAt": "2026-10-14T14:00:00+09:00",
      "dateText": "2026년 10월 14일(수)",
      "timeText": "13:00–14:00",
      "location": {
        "name": "KAIST 교육지원동(W8) 1층 K-Space",
        "building": "W8",
        "room": "1층 K-Space"
      },
      "food": {
        "provided": "true",
        "type": "meal",
        "description": "햄버거",
        "source": "text"
      },
      "organizer": "KAIST 녹색성장지속가능대학원",
      "eligibility": "KAIST 학생·연구원·창업팀 누구나",
      "sources": [
        {
          "type": "dooray",
          "name": "Dooray"
        }
      ]
    },
    {
      "id": "2774195c-d3d7-467d-bb9d-c138dc031c16",
      "title": "카카오벤처스 Temp Seoul Meetup",
      "summary": "카카오벤처스가 /tmp Seoul과 초기 빌더 및 팀을 바라보는 관점을 소개하는 세션을 진행합니다. 40분 세션, 20분 Q&A 및 네트워킹으로 구성되며 참석자들에게 식사가 준비됩니다.",
      "startAt": "2026-10-07T17:00:00+09:00",
      "endAt": null,
      "dateText": "10월 7일(수)",
      "timeText": "오후 5시",
      "location": {
        "name": "KAIST 창업원",
        "building": "창업원",
        "room": ""
      },
      "food": {
        "provided": "true",
        "type": "meal",
        "description": "식사",
        "source": "text"
      },
      "organizer": "카카오벤처스",
      "eligibility": "",
      "sources": [
        {
          "type": "dooray",
          "name": "Dooray"
        }
      ]
    },
    {
      "id": "6b4d7b25-954b-45e6-910b-749116cc9611",
      "title": "학사과정생 간담회",
      "summary": "교무처가 수업 및 학사제도에 대한 학사과정생의 의견을 듣기 위해 개최하는 간담회입니다. 사전 등록한 참석자에게 간단한 점심식사가 제공됩니다.",
      "startAt": "2026-09-30T12:00:00+09:00",
      "endAt": "2026-09-30T13:00:00+09:00",
      "dateText": "2026.09.30.(수)",
      "timeText": "오후 12시~1시",
      "location": {
        "name": "창의학습관(E11), 1층 102호",
        "building": "창의학습관(E11)",
        "room": "102호"
      },
      "food": {
        "provided": "true",
        "type": "meal",
        "description": "간단한 점심식사",
        "source": "text"
      },
      "organizer": "교무처",
      "eligibility": "KAIST에 재학중인 학사과정생",
      "sources": [
        {
          "type": "dooray",
          "name": "Dooray"
        }
      ]
    }
  ]
}
